basepk,hid,speechdate,pid,opid,speakeroldname,speakerposition,maintopic,subtopic,subsubtopic,speechtext,speakerparty,speakerriding,speakername,speakerurl
4778819,ca.proc.d.2019-05-10.10621656,2019-05-10,3a81a21a-bec2-40b4-aae5-d554237ba474,243017,"Ms. Anita Vandenbeld (Ottawa West—Nepean, Lib.)",,Statements By Members,Flooding in Ottawa West—Nepean,,"Madam Speaker, the last few weeks have been emotional and difficult for communities along the Ottawa River. Two record-breaking floods have occurred now in three years in my riding of Ottawa West—Nepean. The communities of Britannia, Belltown, Crystal Bay, Rocky Point, Lakeview and many others have been battling historic rising water levels that are threatening our homes.
In trying times like these, I was proud to witness the strength and power of people coming together to support our community, the thousands of volunteers who worked tirelessly filling 1.5 million sandbags across the Ottawa-Gatineau region.
To the community volunteers; to the NGOs, such as the Ottawa Volunteer Search and Rescue, the Salvation Army and the Red Cross; to the first responders; to local businesses; to Canadian Army personnel in Operation Lentus, especially 2 Combat Engineer Regiment—on behalf of all of us in this chamber, we give thanks for their hard work and dedication to our community.",Liberal,Ottawa West—Nepean,Anita Vandenbeld,http://www.parl.gc.ca/Parliamentarians/en/members/anita-vandenbeld(243017)
4778820,ca.proc.d.2019-05-10.10621661,2019-05-10,4437c848-d8c7-4a39-a948-1539969f3a90,234764,"Ms. Marilyn Gladu (Sarnia—Lambton, CPC)",,Statements By Members,National Nursing Week,,"Madam Speaker, as the shadow minister of health, I am pleased to celebrate National Nursing Week. The theme for 2019 is “Nurses: A Voice to Lead – Health for All”. This is appropriate, given the leadership of over 421,000 nurses on the front lines of our health care system across Canada. Each and every day, they deliver compassionate, professional care to their patients.
 I know this very well because my daughter is a nurse who has worked in intensive care, home care, palliative care, cardiac care and the emergency department. She and the many nurses like her across our nation endure difficult working conditions, violence from patients and they still deliver excellent care.
 With our aging population, we will need many more nurses to join the profession and bring their innovations.
 On behalf of Her Majesty's opposition, we commend all nurses for their contribution to our nation. I thank them for their service.",Conservative,Sarnia—Lambton,Marilyn Gladu,http://www.parl.gc.ca/Parliamentarians/en/members/marilyn-gladu(234764)
4778821,ca.proc.d.2019-05-10.10621664,2019-05-10,ee06377a-6024-40ae-9fe4-a059508592a4,242582,"Mr. Wayne Long (Saint John—Rothesay, Lib.)",,Statements By Members,The Environment,,"Madam Speaker, as residents of a coastal community, we live on the front lines of the battle against climate change in Saint John—Rothesay. 
I would like the incredible young leaders from Saint John High School, St. Malachy’s Memorial High School, Harbour View High School, Simonds High School and Rothesay High School, who demonstrated last week to call upon their elected representatives to take concrete action to tackle climate change, to know this. I rise today on this “Fridays for Future” to stand in solidarity with them by standing in support of our federal government's plan to tackle climate change.
 Our government's plan is the most ambitious federal government climate change plan in Canadian history. The incredible young leaders in Saint John—Rothesay, who took to the streets to demand climate action, deserve a member of Parliament who will stand up for them in this place by standing up for such ambitious climate action. ",Liberal,Saint John—Rothesay,Wayne Long,http://www.parl.gc.ca/Parliamentarians/en/members/wayne-long(242582)
4778822,ca.proc.d.2019-05-10.10621667,2019-05-10,e44116f8-75a8-4ca6-9ba5-fe968dbd42b0,242061,"Mr. Sean Casey (Charlottetown, Lib.)",,Statements By Members,Prince Edward Island,,"Madam Speaker, yesterday, in his hometown of Georgetown, P.E.I., Dennis King was sworn in as the 33rd premier of P.E.I., along with his cabinet.
 I rise to offer my congratulations to Premier King and his government. He has vowed to take a collaborative approach in his dealings with other parties and levels of government, and I stand ready to work with him to advance the interests of islanders.
 I also ask the House to join me in thanking Wade Maclauchlan for his service to our province. He has balanced the books and achieved remarkable success in employment, economic and population growth.
 After a distinguished career in academia, he took on what he referred to as his “retirement project”; the premiership of the province he loved. His incredible intellect, photographic memory and a killer work ethic have served islanders well. He left the place better than he found it. He poured his heart and soul into public service, and for that I offer gratitude and respect. ",Liberal,Charlottetown,Sean Casey,http://www.parl.gc.ca/Parliamentarians/en/members/sean-casey(242061)
4778823,ca.proc.d.2019-05-10.10621670,2019-05-10,00000000-0000-0000-0000-000000000000,247667,"Mr. Scot Davidson (York—Simcoe, CPC)",,Statements By Members,Government Policies,,"Madam Speaker. the residents of York-Simcoe went to the polls just three months ago to elect me as their member of Parliament. However, most cannot wait for the opportunity to vote again this fall, and I do not blame them. The people of York—Simcoe are tired of the Liberal government's record of broken promises, ethical scandals, economic failures and foreign policy blunders.
The Prime Minister promised sunny ways in 2015 with a new approach of honesty and responsibility. However, the reality now faced by ordinary Canadians is high taxes, out-of-control spending and a government out of touch with the struggles of everyday families, seniors and students. This is especially apparent to the residents of York—Simcoe and other communities in rural Canada, who find themselves on the outside looking in, as the Prime Minister attacks them and their way of life.
 Canadians across the country will have an opportunity to change all of that in the upcoming election. Until then, it is clear that the Prime Minister is not as advertised.",Conservative,York—Simcoe,Scot Davidson,http://www.parl.gc.ca/Parliamentarians/en/members/scot-davidson(247667)
4778824,ca.proc.d.2019-05-10.10621674,2019-05-10,04ef6f9c-3039-4fb0-a1ad-82a6ba2f03bf,242090,"Mr. Peter Schiefke (Vaudreuil—Soulanges, Lib.)",,Statements By Members,Vaudreuil—Soulanges,,"Madam Speaker, volunteers are the backbone of our communities. These ordinary women and men do extraordinary things. Not only are these people helping their fellow Canadians, but they are also building better communities for everyone.
Today, I want to take a moment to recognize members of my community who improve the lives of others, one selfless act at a time. These are local heroes, such as the hundreds of volunteers giving their time at the Hudson palliative care centre or the ones helping out community members in need through organizations like the scouts, the guides, the cadets, Nova Hudson, L'Actuel, Moisson Sud-Ouest, les maisons des jeunes and Le Pont Bridging. It is also our farmers, business owners and neighbours, young and old, who more recently helped prepare meals and filled up sandbags for neighbours whose lives had been touched and impacted by this year's historic floods. 
On behalf of the House, I thank all volunteers whose service and generosity make our communities and our country better.",Liberal,Vaudreuil—Soulanges,Peter Schiefke,http://www.parl.gc.ca/Parliamentarians/en/members/peter-schiefke(242090)
4778825,ca.proc.d.2019-05-10.10621712,2019-05-10,65916721-c92d-4ae1-80e6-2e696b0c5d94,234523,"Mr. Darrell Samson (Sackville—Preston—Chezzetcook, Lib.)",,Statements By Members,First Responders,,"Madam Speaker, I would like to recognize the vital work that first responders do to protect and serve our communities. Each day, they bravely put their lives on the line to ensure we can live with peace of mind.
This weekend in my riding there are two great events. 
The first event is a carwash at the Gordon R. Snow Community Centre, hosted by volunteer firefighters from stations in Fall River, Wellington and Waverley. All proceeds of the carwash will go toward Camp Courage. This camp introduces young women to the demands of being a first responder and encourages them to pursue a career as first responders.
The second event is an emergency preparedness jamboree in Porters Lake. The annual jamboree is a community awareness project that can help prepare residents and their families for any type of emergency.
I would personally like to thank all first responders for their tireless work for our communities.",Liberal,Sackville—Preston—Chezzetcook,Darrell Samson,http://www.parl.gc.ca/Parliamentarians/en/members/darrell-samson(234523)
4778826,ca.proc.d.2019-05-10.10621716,2019-05-10,00000000-0000-0000-0000-000000000000,234359,"Mrs. Stephanie Kusie (Calgary Midnapore, CPC)",,Statements By Members,Natural Resources,,"Madam Speaker, the Liberals' anti-energy policies and legislation have destroyed Canada and Alberta's reputation as a stable, fair, predictable destination for energy investment.
 The Prime Minister has failed to take substantial action or exert federal jurisdiction to ensure TMX could be built by the private sector. He cancelled the northern gateway pipeline and he killed the energy east pipeline with red tape and regulations. He implemented a carbon tax, which does nothing but make life more difficult for Canadian families and small businesses.
Canadians cannot afford to continue paying for the Liberal government's failings. More than 100,000 people in the energy sector have already lost their jobs. However, hope is on the horizon with a newly elected United Conservative Party in Alberta. An increasing number of provinces, representing 59% of Canadians, oppose the Prime Minister's carbon tax.
Canadians are not stupid. They know this tax is just another money grab for the Liberal government. It is clear that the Prime Minister is not as advertised.",Conservative,Calgary Midnapore,Stephanie Kusie,http://www.parl.gc.ca/Parliamentarians/en/members/stephanie-kusie(234359)
4778827,ca.proc.d.2019-05-10.10621719,2019-05-10,86a43c8a-1145-4984-af24-0fe651826173,246175,"Ms. Pam Damoff (Oakville North—Burlington, Lib.)",,Statements By Members,Williams Syndrome Awareness Month,,"Madam Speaker, May is Williams Syndrome Awareness Month. Williams syndrome is a genetic condition that remains virtually unknown. Medical, developmental and learning challenges typically occur alongside unique abilities, such as advanced verbal and communication skills, highly social personalities and a passion for music.
 Those abilities describe my friend, Karina Scali. Karina lives with Williams syndrome and has been selected again this year to participate in the Lifting Lives Music Camp in Nashville, designed for young people with Williams syndrome. The Academy of Country Music was so impressed by the song her group wrote a few years ago that it invited the group to perform at the Grand Ole Opry.
Karina received the Queen Elizabeth II Diamond Jubilee Medal for her work in our community.
I ask members to join me in raising awareness of Williams syndrome so all individuals with Williams syndrome will have the support they need to live healthy, self-directed, productive and fulfilling lives like Karina does.",Liberal,Oakville North—Burlington,Pam Damoff,http://www.parl.gc.ca/Parliamentarians/en/members/pam-damoff(246175)
4778828,ca.proc.d.2019-05-10.10621723,2019-05-10,4c0122f7-7958-4cbd-b99e-9d70a4dca1e8,248383,"Mr. Pierre-Luc Dusseault (Sherbrooke, NDP)",,Statements By Members,Quebec Diabetes Association,,"Madam Speaker, I have the privilege this year of serving as honourary chair of the 19th annual golf tournament organized by Diabète Estrie, a non-profit organization in my region made up of people with diabetes, their loved ones, and health care professionals who are trying to make things easier for people with this disease and improve their quality of life.
With the money raised, Diabète Estrie will be able to send kids aged eight to 15 with type 1 diabetes to specialized camps. The money also helps the organization pursue its mission to inform, promote awareness, provide training, support research, ensure service provision and defend the rights of diabetics to help them live with this disease in their day-to-day lives.
I encourage everyone to come out to this event on June 7, as part of Quebec's diabetes prevention week. 
In closing, I want to thank all the members of the organizing committee as well as the many volunteers who dedicate themselves to this cause every year.",New Democratic Party,Sherbrooke,Pierre-Luc Dusseault,http://www.parl.gc.ca/Parliamentarians/en/members/pierre-luc-dusseault(248383)
4778829,ca.proc.d.2019-05-10.10621727,2019-05-10,831322ab-9fa6-437e-92ba-1b4525f8242d,242429,"Mr. Pat Kelly (Calgary Rocky Ridge, CPC)",,Statements By Members,Government Policies,,"Madam Speaker, in 2015, the Prime Minister promised small annual deficits, with a self-balancing budget by 2019. Instead, we got the biggest peacetime debt accumulation outside of a recession. 
He promised openness and transparency and we got cash for access fundraising and illegal vacations. He promised to help small-business owners, then called them tax cheaters and threatened their savings. He said, “Canada is back” and then humiliated himself in India. He promised better relations with the public service and then launched Phoenix. He promised better relations with veterans and then said they were asking too much. He promised a service-focused CRA and then picked on single parents and the disabled, while giving tax breaks to wealthy people with offshore accounts. He promised no more omnibus bills and then snuck deferred prosecutions into a 500-page budget bill and fired his attorney general for refusing to play ball and get SNC-Lavalin off the hook.
The Prime Minister is definitely not as advertised.",Conservative,Calgary Rocky Ridge,Pat Kelly,http://www.parl.gc.ca/Parliamentarians/en/members/pat-kelly(242429)
4778830,ca.proc.d.2019-05-10.10621730,2019-05-10,7a2a1996-59b6-46e8-8ed0-9ea3c0fcf4ad,245467,"Mr. Marc Serré (Nickel Belt, Lib.)",,Statements By Members,Speech and Hearing Month,,"Madam Speaker, May is Speech and Hearing Month. It is important to recognize Canada's outstanding speech-language pathologists, audiologists and communication health assistants, who I was honoured to work with as regional director of the Canadian Hearing Society.
Speech-Language &amp; Audiology Canada will be highlighting the importance of early detection and intervention of speech, language, swallowing, hearing and balance disorders. This builds on the early hearing detection report card released last month, which noted that Canada's overall grade still remained “insufficient”. 
The ability to speak, to listen and to be heard is vital. Children's access to hearing care should not be determined by their personal circumstances. Professionals seek to ensure optimal communication health whether they are working with a hard-of-hearing child or adult or a family dealing with dementia.
I ask my colleagues to join me in observing Speech and Hearing Month in Canada.",Liberal,Nickel Belt,Marc Serré,http://www.parl.gc.ca/Parliamentarians/en/members/marc-serre(245467)
4778831,ca.proc.d.2019-05-10.10621744,2019-05-10,96924c12-efff-4de2-9f9e-578fe5434342,218606,"Hon. Erin O'Toole (Durham, CPC)",,Oral Questions,Justice,,"Madam Speaker, Scott Brison wanted to stop the $700-million Davie shipbuilding contract. Scott Brison, Judy Foote and the MP for Beauséjour were lobbied by corporate friends to kill the deal. The only reason they did not was the fact that their actions at cabinet leaked out.
Vice-Admiral Mark Norman was not the source of the cabinet leak, but his was the only name put forward to blame. Why?",Conservative,Durham,Erin O'Toole,http://www.parl.gc.ca/Parliamentarians/en/members/erin-otoole(218606)
4778832,ca.proc.d.2019-05-10.10621746,2019-05-10,18e36567-4082-4ce3-a35b-d4aba65560ca,245291,"Hon. David Lametti (Minister of Justice and Attorney General of Canada, Lib.)",,Oral Questions,Justice,,"Madam Speaker, we have full confidence in our government institutions, and they all functioned very well in this case. The RCMP investigated and laid charges. The investigation, the decision to lay charges and the prosecution were handled by the Public Prosecution Service of Canada, as was the decision to stay charges.
All those decisions were made independently of the Department of Justice, of my office and of the Government of Canada. Our institutions are functioning well, and the rule of law is alive and well in Canada.",Liberal,LaSalle—Émard—Verdun,David Lametti,http://www.parl.gc.ca/Parliamentarians/en/members/david-lametti(245291)
4778833,ca.proc.d.2019-05-10.10621748,2019-05-10,96924c12-efff-4de2-9f9e-578fe5434342,218606,"Hon. Erin O'Toole (Durham, CPC)",,Oral Questions,Justice,,"Madam Speaker, we are confident that the director of public prosecutions did her job and made the right call to admit that there was no case against Mark Norman, but Mark Norman's name was first given to the RCMP by the Prime Minister. Mark Norman was not at the cabinet meeting. Mark Norman was not the source of the cabinet leak. In fact, he was just one of 73 names of people who knew about Scott Brison's attempt to kill the Davie deal.
Why did the Prime Minister single out Vice-Admiral Mark Norman to blame for the leak from his cabinet meeting?",Conservative,Durham,Erin O'Toole,http://www.parl.gc.ca/Parliamentarians/en/members/erin-otoole(218606)
4778834,ca.proc.d.2019-05-10.10621752,2019-05-10,18e36567-4082-4ce3-a35b-d4aba65560ca,245291,"Hon. David Lametti (Minister of Justice and Attorney General of Canada, Lib.)",,Oral Questions,Justice,,"Madam Speaker, as the hon. member well knows, investigations are the realm of the RCMP in Canada, and it did that.
As the hon. member well knows, the decision to lay charges, to evaluate that evidence and lay charges, rests with the Public Prosecution Service of Canada, and that was done here, as was the decision to stay charges.",Liberal,LaSalle—Émard—Verdun,David Lametti,http://www.parl.gc.ca/Parliamentarians/en/members/david-lametti(245291)
4778835,ca.proc.d.2019-05-10.10621755,2019-05-10,96924c12-efff-4de2-9f9e-578fe5434342,218606,"Hon. Erin O'Toole (Durham, CPC)",,Oral Questions,Justice,,"Madam Speaker, the Prime Minister gave Mark Norman's name to the RCMP. The Prime Minister's Office resisted giving documents to Mark Norman's lawyers. The Prime Minister's team counselled witnesses. The Prime Minister's lawyers asked the prosecutors if they could engineer issues at trial. The Prime Minister's Office even used code words to avoid revealing Mark Norman's name in documents.
Direction, deception and delay: that is the Prime Minister's record of political interference in the Vice-Admiral Norman affair. When will he apologize to Mark Norman?",Conservative,Durham,Erin O'Toole,http://www.parl.gc.ca/Parliamentarians/en/members/erin-otoole(218606)
4778836,ca.proc.d.2019-05-10.10621758,2019-05-10,ddcc96da-5bcf-4069-9cd6-da8f76df8b89,242073,"Mr. Stéphane Lauzon (Parliamentary Secretary to the Minister of Veterans Affairs and Associate Minister of National Defence, Lib.)",,Oral Questions,Justice,,"Madam Speaker, on the basis of this week's decision, the charge against Vice-Admiral Norman has been stayed.
As confirmed by the Public Prosecution Service of Canada this week, every decision was made completely independently. No other factors were considered in this decision, nor was there any contact or influence from outside the PPSC, including political influence in either the initial decision to prosecute Mr. Norman or in the decision to stay the charge.
Any accusation to the contrary is absurd. ",Liberal,Argenteuil—La Petite-Nation,Stéphane Lauzon,http://www.parl.gc.ca/Parliamentarians/en/members/stephane-lauzon(242073)
4778837,ca.proc.d.2019-05-10.10621761,2019-05-10,22a96405-bed6-45e9-811a-69d055416803,242520,"Hon. Steven Blaney (Bellechasse—Les Etchemins—Lévis, CPC)",,Oral Questions,Justice,,"Madam Speaker, it is simple. As soon as the Liberals took office they did everything in their power to prevent the Davie shipyard from getting the Asterix contract, a vital contract for the Royal Canadian Navy. 
What did they do when they got caught red-handed? Instead of launching an investigation to shed light on this scheme, the Prime Minister attacked the person who blew the whistle on their scheme, Vice-Admiral Norman.
When will the Prime Minister apologize and give Vice-Admiral Norman a promotion instead of demotion?",Conservative,Bellechasse—Les Etchemins—Lévis,Steven Blaney,http://www.parl.gc.ca/Parliamentarians/en/members/steven-blaney(242520)
4778838,ca.proc.d.2019-05-10.10621764,2019-05-10,ddcc96da-5bcf-4069-9cd6-da8f76df8b89,242073,"Mr. Stéphane Lauzon (Parliamentary Secretary to the Minister of Veterans Affairs and Associate Minister of National Defence, Lib.)",,Oral Questions,Justice,,"Madam Speaker, no other factors were considered in this decision, nor was there any contact or influence from outside the PPSC, including political influence, on the initial decision to prosecute Mr. Norman.
Based on this week's decision, the charges against Vice-Admiral Norman have been stayed. Every decision was made completely independently. ",Liberal,Argenteuil—La Petite-Nation,Stéphane Lauzon,http://www.parl.gc.ca/Parliamentarians/en/members/stephane-lauzon(242073)
4778839,ca.proc.d.2019-05-10.10621767,2019-05-10,22a96405-bed6-45e9-811a-69d055416803,242520,"Hon. Steven Blaney (Bellechasse—Les Etchemins—Lévis, CPC)",,Oral Questions,Justice,,"That is ludicrous, Madam Speaker. The Liberal closet is full of skeletons—those of ministers, advisors, assistants, and even the clerk.
The Liberals should tell the truth and stop going after a man who told the truth and stood up for the Royal Canadian Navy and for Quebec.
What are Quebec MPs doing for jobs in Quebec?
The shipyard workers want work. They want the contract for the Obelix.",Conservative,Bellechasse—Les Etchemins—Lévis,Steven Blaney,http://www.parl.gc.ca/Parliamentarians/en/members/steven-blaney(242520)
4778840,ca.proc.d.2019-05-10.10621770,2019-05-10,ddcc96da-5bcf-4069-9cd6-da8f76df8b89,242073,"Mr. Stéphane Lauzon (Parliamentary Secretary to the Minister of Veterans Affairs and Associate Minister of National Defence, Lib.)",,Oral Questions,Justice,,"Madam Speaker, no other factors were considered in this decision. Based on this week's decision, the deputy minister has reviewed the policy in place regarding the request to have his legal fees paid as they relate to this case.
We agreed with their advice.",Liberal,Argenteuil—La Petite-Nation,Stéphane Lauzon,http://www.parl.gc.ca/Parliamentarians/en/members/stephane-lauzon(242073)
4778841,ca.proc.d.2019-05-10.10621772,2019-05-10,4bc128a9-b349-4867-a545-ad05122c0e46,217242,"Ms. Niki Ashton (Churchill—Keewatinook Aski, NDP)",,Oral Questions,The Environment,,"Madam Speaker, let us look at Liberal government rhetoric versus Liberal government action on climate change. The Liberals said they put a price on carbon, but it will not apply to 80% of major emissions. They said they were going to force corporate Canada to take the climate crisis seriously, but here is $12 million for fridges, Loblaws. They said they would help phase out oil and gas, but today we hear that they are paying $54 billion in new subsidies to the billionaire fossil fuel industry. 
Instead of hooking up their billionaire pals, when will the government take climate change seriously and bring in a green new deal?",New Democratic Party,Churchill—Keewatinook Aski,Niki Ashton,http://www.parl.gc.ca/Parliamentarians/en/members/niki-ashton(217242)
4778842,ca.proc.d.2019-05-10.10621776,2019-05-10,cee27afa-cdf8-4e99-ab22-22290f86aa3a,214082,"Hon. Catherine McKenna (Minister of Environment and Climate Change, Lib.)",,Oral Questions,The Environment,,"Madam Speaker, I am always happy to talk about our climate change plan. Yes, it includes a price on pollution. Polluters need to pay, but we are giving the money back. That means that a family of four in Ontario will get $307. We are phasing out coal. We are making historic investments in renewables, but we are also ensuring a just transition for workers, because we need to make sure that workers and communities can thrive as we move to a cleaner future. We are focused on making historic investments in public transportation, which is something the NDP would not have done, because it planned to balance the budget and not make those historic investments. We are also making historic investments in clean solutions and energy efficiency. We have a climate plan—",Liberal,Ottawa Centre,Catherine McKenna,http://www.parl.gc.ca/Parliamentarians/en/members/catherine-mckenna(214082)
4778843,ca.proc.d.2019-05-10.10621778,2019-05-10,cedf1659-ebb1-4f26-b723-5c7c5353988b,214948,The Assistant Deputy Speaker (Mrs. Carol Hughes),,Oral Questions,The Environment,,The hon. member for Churchill—Keewatinook Aski.,New Democratic Party,Algoma—Manitoulin—Kapuskasing,Carol Hughes,http://www.parl.gc.ca/Parliamentarians/en/members/carol-hughes(214948)
