basepk,hid,speechdate,pid,opid,speakeroldname,speakerposition,maintopic,subtopic,subsubtopic,speechtext,speakerparty,speakerriding,speakername,speakerurl
4778949,ca.proc.d.2019-05-10.10622168,2019-05-10,bd2068aa-74c7-430a-bdf5-6f17b14ca140,217464,"Mr. Tom Kmiec (Calgary Shepard, CPC)",,Government Orders,Oceans Act,,"Madam Speaker, I am very pleased to be joining the debate on Bill C-55 to contribute a couple of thoughts.
My colleague from North Okanagan—Shuswap gave an excellent overview of the contents of the bill and the substance of the amendments being proposed by the Senate. It has proposed a couple of measures that would improve accountability. 
There is a series of common-sense ideas. They are very technical in nature. When I went through them, they gave me pause. I though about the implications for the minister of the requirement to consult and how to consult? I thought about how the government would deal with applying some of the other measures in the real world.
A lot of what we do in Ottawa is put theory into legal practice and provide the wording for what we want departmental officials to do on the ground. However, there is also an entire portion related to the application of the legislation and regulations. We want to know how it will work in the field. How will the ideas in this chamber, brought forward by the government through legislation and by government members and opposition members through amendments, actually work out in the real world?
It is not enough to have good intent. It is also what happens on the ground. The reality on the ground is extremely important in whether the legislation will achieve those goals. Intent is fine. I think intent is laudable. We talk a lot about that as politicians. However, it is the results on the ground that count the most. Did we achieve the goals we set out? Do we have a metric to measure how the legislation is working?
The member from North Okanagan—Shuswap gave an excellent overview of the work both parties on the opposition side have done in proposing amendments and improvements to the bill at various stages, going back to when the bill was before the House of Commons committee. Between 25 and 30 amendments were proposed at that time to try to improve the legislation.
I have been on different committees, and often I have seen government legislation that has technical flaws in it. Some of the flaws are inadvertent. They are simply copied and pasted from other pieces of legislation. Perhaps they had a good intent at one time, but when we sit down with officials and stakeholder groups, we quickly realize that they would have several unintended consequences. I will get to one of the unintended consequences of the MPA processes.
When sections of bills are being changed, or improved, as the government would say, I have seen members try to amend them at committee. I have done this myself. I have proposed amendments to government legislation that I thought would improve a bill and fix it in a substantive way, perhaps by amending a definition, as I tried to do on the medical assistance in dying bill, to provide a more technical definition.
With respect to Bill C-55, we are talking about Senate amendments that, as I mentioned, would improve the accountability of the minister to both Parliament and Canadians. They are common-sense ideas. Whether the amendments and the ideas therein are properly executed deserves further investigation and deliberation.
Bill C-55 would maximize the minister's powers. I have mentioned several times in this chamber, on other pieces of legislation proposed by the government, how opposed I am to maximizing ministerial discretion, especially on things like MPAs, which have an immense economic impact on the livelihoods of people in smaller communities, people who depend on fisheries for their livelihood.
It is incumbent upon any government and any member of Parliament to ensure that ministers are reined in and do not have free rein to do as they wish. Too much of the legislation that has passed in the House leaves it up to cabinet, through orders in council, to decide what the details will be. 
I will draw the attention of the House to the cannabis bill, which decriminalized or legalized the sale and distribution of cannabis in Canada, and to the impaired driving bill. These bills created a litany of regulations that were basically to be written by a minister and then approved by cabinet at some point.
Some of them were very basic concepts, like definitions that should simply be taken out of a dictionary. We have the same situation here, where the minister's discretion and ability to intervene and interfere in a local area's decision-making process is very broad. 
That is a deficiency in any government legislation, because often when we then ask those ministers to return to committees and provide a summary, provide some type of semblance of what was done with the powers, in almost every situation that I have experienced so far, I have been disappointed when ministers returned to committee to explain how they used the powers. They either went way overboard in their application or fell far short and actually did not pass a regulation that met the requirements of Parliament, thus being unable to achieve the goals that the legislation set out.
Just yesterday, at the Standing Joint Committee for the Scrutiny of Regulations, where eventually the regulations that Bill C-55 would enable will make their way for gazetting and review and approval, I saw another instance of a government regulation being used by two previous governments, both Liberal and Conservative, whereby the officials in the department had collected information they were not legally allowed to collect. 
Then an amendment to a piece of legislation was passed in 2012, and at that point, that collection of information was legalized. The logical question that all parliamentarians asked, including members in the government caucus and members of the Conservative caucus and members of the NDP caucus, was that if this collection of information was legalized in 2012, was it illegal before that? That was what the legal counsel for the committee was telling members of Parliament was in fact the case—that the government officials had improperly collected a whole suite of very sensitive, proprietary, corporate economic information.
My worry with Bill C-55 is again the broad discretion being given to the minister during the consultation process and the set-up of the MPA. 
I want to quote Jim McIsaac of the BC Commercial Fishing Caucus, who said:
 Right now on the west coast we have 10 or 12 different MPA processes. It's impossible for the fishing industry to engage in all of these in a kind of comprehensive way. We need a place where we can sit down and set some of these overarching objectives. If we don't do that, it's just going to disintegrate into a mess. It won't be durable going on. We need a way to bring all available knowledge into these. 
That speaks to some of that consultation overload. Consultation is a great thing. I participate in government consultations when they post them on the website. I will mention one right after this, on the Asian Infrastructure Investment Bank, just as an illustration of where I think the problem with this consultation on the MPAs exists.
Having 10 or 12 MPA consultation processes at the same time overwhelms one particular industry. It is too much in one area for one group, one sector, one group of workers in an economy to be able to answer to when we want in-depth, valuable information to be provided. We do not just want boxes checked. 
The government has indicated that it does not agree with the Senate amendments and did not agree with many of the Conservative amendments at the House of Commons committee when the bill found itself there, and in this legislation what the government is trying to do is outsmart everybody. I think that is the greatest folly. It is a Yiddish proverb. It is one that has been used many times. We as parliamentarians should know, and the government should know, that it is impossible to know everything. 
That is what consultation is supposed to be about. It is the process of discovering what we do not know; it is not supposed to be about affirming what we think we know. It is about discovering what we do not know.
In this case, my thought is that if we do 10 to 12 different consultations, again as with these MPA processes, it will overwhelm a particular industry. I am much more familiar with energy site consultations on indigenous communities at the Alberta provincial level. In a prior life, I worked for the Alberta finance minister at the time and the minister of sustainable resource development at the time. Our sustainable resources in Alberta do not happen to be fisheries. Unfortunately, fisheries are not a major sector in the Alberta economy, but they are a major sector in the British Columbia economy, and we should be worried by what we hear.
We should be worried when groups are telling us that the proposal in the legislation may overwhelm their ability to provide in-depth valuable information, whether it is traditional knowledge or qualitative or quantitative data that their industry collects just as part of doing business and part of proposing what they think. Again, the consultation angle here is that there could be an overwhelming number of them and that would make it very difficult for them to meet it.
I want to provide another quote for the chamber's consideration from Christina Burridge, the executive director of the BC Seafood Alliance. She states:
 Closing large areas to fishing off the west coast does little for biodiversity, little for conservation, little for the men and women up and down the coast who work in our sector and who are middle class or aspire to the middle class, and little for the health of Canadians, who deserve access to local, sustainable seafood. 
Again, that is valuable input from another organization that feels these proposed MPAs might have a fine purpose in mind, but the difference being the intent and impact on the ground, the reality of what will be done.
Several members have mentioned during debate on the legislation that they are concerned that the minister will have simply too broad a series of powers to do as he or she wants, such as to declare a certain area, cut out a certain border for the MPA first and then consult after the fact. However, the economic impact is immediate. People in the area who depend on this type of fishery or it is a significant part of what they do on a daily basis will not be able to continue to do so. They will have to consult with the minister as part of an organization or individually.
There is always the possibility that the government will of course listen to a particular stakeholder group and will defer. It will move boundaries. It will change them to meet the demands. However, the impact will have already happened. There will be already investors, perhaps or individuals who will have changed their behaviour, either their purchasing behaviour or the fishing practices they had. In the meantime, people still have to make an income at the end of the day. They still have to make ends meet. They still have to pay their one's taxes, because the government will never let up on that. They still has to attain some type of middle-class lifestyle. People cannot just lay down their tools and wait for the government to finish its consultation process. They cannot wait for the minister to be satisfied that they have met the requirements of the law.
Some of the defects and shortcomings in the bill could be addressed by some of the proposals in a Senate amendment. We can look back, as the member for North Okanagan—Shuswap mentioned, to some of the amendments proposed on the Conservative side at committee about improving the way the consultation would be done to protect the workers out there. Part of the amendments proposed here also touch upon some of the announcements made by the government.
The government made an announcement that it intended to spend about $1.5 billion on ocean protection off the west coast. It was part of its goal to reach some of its international targets and it was part of the process toward attaining and ensuring the construction of the Trans Mountain expansion pipeline, so meeting some of the public concerns that individuals had. I have a couple of issues in how this legislation and those dollar announcements matter.
We heard from the previous auditor general, who passed away tragically from cancer. He filed a report late last year, saying that the government was more interested in big dollar announcements in its news releases. He went in-depth in attacking the government's means of testing how it was achieving its goals. He said that it rated its success according to how much money had been shovelled out the door, not the actual impacts on the ground. He had a more broader critique on how the government had managed its operations.
Bill C-55 operationalizes MPAs in a lot of ways. It is much meatier legislation than people might realize. Many people realize that the consultation processes and the conservation of these broad maritime ecosystems and the termination of economic activity in many of these areas for certain types of fisheries or the potential of certain types of fisheries is a big operational part of government.
Time and time again, in different parts of the government, we have seen their inability to meet their own department plans, which every minister tables in the House. There are many shortcomings on that side, such as loading up departments with more work while cutting back on the total FTE count of employees in the department.
The government seems to rate its success simply by how much money has gone out the door, or sometimes, if the money has not even moved, by the quality of the news release being put out and the dollar figure. If there is “billion” in the number, the government will say that it is a job well done, that the mission was successful and that it has achieved its goals.
I will go back to the TMX pipeline for a moment, because I am a member who represents a Calgary riding and I am an Albertan. The TMX pipeline is a perfect example. The government created an investment environment, or a public policy situation, where a company felt obliged to give public notice to its shareholders after a board meeting that it was thinking of backing out of the pipeline expansion. It was not going to meet its goals. The government had created that environment, and it felt obliged to expropriate the pipeline from Kinder Morgan and purchase it for $4.5 billion. 
Here comes the operationalizing component. My worry about Bill C-55 is whether the government will be able to operationalize all of this and whether it is overwhelming communities with too much consultation. The government has not been able to build a single inch of pipe to twin the TMX line to the west coast, despite the fact that it promised legislation, despite the fact that it promised, over 300 days ago, that it would get the pipeline built, and despite the fact that almost two construction seasons have been thrown away.
I hear a member on the government caucus side from Toronto heckling me. I remind him that the previous government approved four pipelines. I remind him that the previous government had a record of actually building pipelines. I also remind him that under his government's watch, the government he defends, over 7,000 kilometres of pipe has been cancelled in this country. 
The LNG Canada project on the west coast is a $40-billion project that was approved by the regulator in 2012 and approved by the previous Stephen Harper government. They approved it. It took six years before the company felt that the business environment was good enough. For three years, from 2015 to 2018, the project was on the cusp of being cancelled. The only thing that saved the project was that the government exempted it from the carbon tax. That is the only reason the company went ahead with a $40-billion project. As well, under the government's watch, 78 billion dollars' worth of LNG projects have been cancelled.",Conservative,Calgary Shepard,Tom Kmiec,http://www.parl.gc.ca/Parliamentarians/en/members/tom-kmiec(217464)
4778950,ca.proc.d.2019-05-10.10622193,2019-05-10,cedf1659-ebb1-4f26-b723-5c7c5353988b,214948,The Assistant Deputy Speaker (Mrs. Carol Hughes),,Government Orders,Oceans Act,,The hon. member will have two minutes remaining the next time this bill is before the House.,New Democratic Party,Algoma—Manitoulin—Kapuskasing,Carol Hughes,http://www.parl.gc.ca/Parliamentarians/en/members/carol-hughes(214948)
4778951,ca.proc.d.2019-05-10.10622206,2019-05-10,48fc6e8f-3117-407b-bba3-bd6eede347ec,224672,"Hon. Bardish Chagger (Leader of the Government in the House of Commons, Lib.)",,Government Orders,Oceans Act,Bill C-55—Notice of Time Allocation,"Madam Speaker, an agreement could not be reached under the provisions of Standing Orders 78(1) or 78(2) with respect to the consideration of the Senate amendments to Bill C-55, an act to amend the Oceans Act and the Canada Petroleum Resources Act.
 Under the provisions of Standing Order 78(3), I give notice that a minister of the Crown will propose, at the next sitting, a motion to allot a specific number of days or hours for the consideration and disposal of proceedings at the said stage. ",Liberal,Waterloo,Bardish Chagger,http://www.parl.gc.ca/Parliamentarians/en/members/bardish-chagger(224672)
4778952,ca.proc.d.2019-05-10.10622297,2019-05-10,48fc6e8f-3117-407b-bba3-bd6eede347ec,224672,"Hon. Bardish Chagger (Leader of the Government in the House of Commons, Lib.)",,Government Orders,Business of the House,,"Madam Speaker, pursuant to Standing Order 81(4), I would like to designate Wednesday, May 15, for consideration in committee of the whole of the main estimates for the Department of National Defence.",Liberal,Waterloo,Bardish Chagger,http://www.parl.gc.ca/Parliamentarians/en/members/bardish-chagger(224672)
4778953,ca.proc.d.2019-05-10.10622210,2019-05-10,cedf1659-ebb1-4f26-b723-5c7c5353988b,214948,The Assistant Deputy Speaker (Mrs. Carol Hughes),,Government Orders,Business of the House,,"It being 1:30 p.m., the House will now proceed to the consideration of Private Members' Business as listed on today's Order Paper.",New Democratic Party,Algoma—Manitoulin—Kapuskasing,Carol Hughes,http://www.parl.gc.ca/Parliamentarians/en/members/carol-hughes(214948)
4778954,ca.proc.d.2019-05-10.p5904194,2019-05-10,,,,stagedirection,Private Members' Business,Ending the Captivity of Whales and Dolphins Act,,"The House proceeded to the consideration of Bill S-203, An Act to amend the Criminal Code and other Acts (ending the captivity of whales and dolphins), as reported (without amendment) from the committee.",,,,
4778955,ca.proc.d.2019-05-10.10622307,2019-05-10,cedf1659-ebb1-4f26-b723-5c7c5353988b,214948,The Assistant Deputy Speaker (Mrs. Carol Hughes),,Private Members' Business,Ending the Captivity of Whales and Dolphins Act,,"There being no motions at report stage, the House will now proceed, without debate, to the putting of the question of the motion to concur in the bill at report stage.",New Democratic Party,Algoma—Manitoulin—Kapuskasing,Carol Hughes,http://www.parl.gc.ca/Parliamentarians/en/members/carol-hughes(214948)
4778956,ca.proc.d.2019-05-10.10622309,2019-05-10,eaa6694f-1e20-4aae-ad3b-e694b0e12c59,224170,"Ms. Elizabeth May (Saanich—Gulf Islands, GP)",,Private Members' Business,Ending the Captivity of Whales and Dolphins Act,,", seconded by the member for Windsor—Tecumseh, moved that the bill be concurred in.",Green Party,Saanich—Gulf Islands,Elizabeth May,http://www.parl.gc.ca/Parliamentarians/en/members/elizabeth-may(224170)
4778957,ca.proc.d.2019-05-10.10622214,2019-05-10,cedf1659-ebb1-4f26-b723-5c7c5353988b,214948,The Assistant Deputy Speaker (Mrs. Carol Hughes),,Private Members' Business,Ending the Captivity of Whales and Dolphins Act,, The question is on the motion. Is it the pleasure of the House to adopt the motion?,New Democratic Party,Algoma—Manitoulin—Kapuskasing,Carol Hughes,http://www.parl.gc.ca/Parliamentarians/en/members/carol-hughes(214948)
4778958,ca.proc.d.2019-05-10.p5904198,2019-05-10,,,,intervention,Private Members' Business,Ending the Captivity of Whales and Dolphins Act,," Agreed.
 On division.",,,Some hon. members,
4778959,ca.proc.d.2019-05-10.p5,2019-05-10,cedf1659-ebb1-4f26-b723-5c7c5353988b,214948,The Assistant Deputy Speaker (Mrs. Carol Hughes),,Private Members' Business,Ending the Captivity of Whales and Dolphins Act,,(Motion agreed to),New Democratic Party,Algoma—Manitoulin—Kapuskasing,Carol Hughes,http://www.parl.gc.ca/Parliamentarians/en/members/carol-hughes(214948)
4778960,ca.proc.d.2019-05-10.10622216,2019-05-10,eaa6694f-1e20-4aae-ad3b-e694b0e12c59,224170,Ms. Elizabeth May,,Private Members' Business,Ending the Captivity of Whales and Dolphins Act,,", seconded by the member for Windsor—Tecumseh, moved that the bill be read the third time and passed.
She said: Madam Speaker, I thank those members who are applauding this historic day. I speak for myself and for many Canadians from coast to coast to coast when I say we are very grateful for the assistance of the hon. Minister of Fisheries, Oceans and the Canadian Coast Guard, the assistance of the hon. Minister of Environment and Climate Change and the assistance of their parliamentary secretaries in assisting this bill to get through this place after its long, long, long gestation in the Senate. We are extremely grateful for that support to expedite the passage of this bill so that it can receive royal assent before this House adjourns for the summer and the election.
I am only going to canvass briefly the elements of the bill; I think we are all very familiar with it. 
It was started in the Senate, where it was sponsored by an absolutely terrific Canadian who would make the case that we should change mandatory retirement at age 75 for members of the Senate. 
Senator Wilfred Moore of Nova Scotia brought this bill forward in 2015. On his retirement, it was taken up by another magnificent and inspiring leader within this country, former jurist Senator Murray Sinclair. All of their work and all of the witnesses in the long hearings before the Senate made the same point over and over again: In the 21st century, we simply know better than to think cetaceans belong in captivity. We can no longer pretend that the entertainment value of these magnificent, sentient creatures in swimming pools anywhere in Canada is acceptable.
Parallel to our efforts on Bill S-203 is a very good bill, Bill C-68, from the former minister of fisheries, the hon. member for Beauséjour. It is is currently before the Senate, and we certainly hope will pass soon. To him, I once again want to underline my deep thanks for all of his work as minister of fisheries.
 Bill C-68, would make it illegal to take a cetacean into captivity in Canadian waters. Bill S-203, finishes that piece and makes it comprehensive by adding that we will not breed cetaceans in captivity, nor will we buy cetaceans from other countries and keep them in captivity. 
We are listening to the science and taking the appropriate actions.
I want to thank other people who have played a significant role in seeing this largely non-partisan effort, supported by thousands and thousands of Canadians, come to this point.
I want to thank the hon. members for Courtenay—Alberni, New Westminster—Burnaby, Beaches—East York and Pontiac; the Minister of Fisheries, Oceans and the Canadian Coast Guard; the Parliamentary Secretary to the Minister of Fisheries, Oceans and the Canadian Coast Guard; the members for West Nova, Avalon, and Charlottetown, and the member for Repentigny from the Bloc Québécois. There was help from members on all sides of the House, including the party that did not support the bill; there are individual members of that party who were very helpful.
The NGO community has been very helpful in assisting the process by networking with good scientists and also making sure the community of Canadians concerned with cetaceans received assistance. That community includes Animal Justice and its spectacular lawyer, Camille Labchuk; the Humane Society of Canada; Humane Society International; Ontario Captive Animal Watch; Animal Alliance of Canada; World Animal Protection; and The Whale Sanctuary Project. Assistance also came from scientists Dr. Lori Marino; Dr. Ingrid Visser, who testified by video link all the way from New Zealand; Dr. Naomi Rose; Dr. Hal Whitehead, of Dalhousie University; and Phil Demers.
All of these scientists, NGOs, individual elected Canadians and those from the unelected other place worked diligently and did their homework with one aim only: to end a practice that we all know is wrong.
It is a great honour for me to have overseen this private members' bill. It is a great honour.
I am surprised by the tremendous support that this bill has received across Canada. At this time, I would like to say just one thing: thank you.
I thank everyone involved and am in their debt, as are our wonderful free whales. Although it was certainly an accident of fate and Parliament that the bill was brought forward by Senator Wilfred Moore, I will say once more “Free Willy”.",Green Party,Saanich—Gulf Islands,Elizabeth May,http://www.parl.gc.ca/Parliamentarians/en/members/elizabeth-may(224170)
