basepk,hid,speechdate,pid,opid,speakeroldname,speakerposition,maintopic,subtopic,subsubtopic,speechtext,speakerparty,speakerriding,speakername,speakerurl
4778905,ca.proc.d.2019-05-10.10621932,2019-05-10,634edc34-ea0d-406f-ade1-eeec6c5bad04,220107,"Mr. Adam Vaughan (Parliamentary Secretary to the Minister of Families, Children and Social Development (Housing and Urban Affairs), Lib.)",,Oral Questions,Social Development,,"Madam Speaker, parents and children in Canada have a very simple message for the Conservatives: Keep your hands off the Canada child benefit.
 The Conservative leader has voted against doubling it. The Conservative leader voted against indexing it. The Conservative leader voted against making it tax free.
 If people want to know what the Conservatives' plan for children is, let them look at Doug Ford's war on children in Ontario. It is what happens when a Conservative government tries to campaign without a platform. 
The Ontario Conservatives have cut teachers for kids. They have cut libraries for kids. They have cut school lunch programs for kids. They have cut the child advocate. They have even cut giving out vaccines for kids. 
When it comes to the Conservatives, Ford's cuts hurt kids, and they are shear stupidity.",Liberal,Spadina—Fort York,Adam Vaughan,http://www.parl.gc.ca/Parliamentarians/en/members/adam-vaughan(220107)
4778906,ca.proc.d.2019-05-10.10621940,2019-05-10,9c9a64e6-58f1-4367-9f49-93ad31744c96,217548,"Mrs. Cathy McLeod (Kamloops—Thompson—Cariboo, CPC)",,Oral Questions,Natural Resources,,"Madam Speaker, residents in B.C. continue to flock across the border to fill their tanks with gasoline. They are saving $25 per tank, and that matters. It matters to Canadian families, it matters to small business, it matters to tourism operators and it matters to so many more.
This minister does not seem to understand what a difference that makes in people's lives. Increasing the carbon tax without a deadline on getting Trans Mountain started is a problem.
When will they get the pipeline built, and when will they get rid of this carbon tax that is hurting so many?",Conservative,Kamloops—Thompson—Cariboo,Cathy McLeod,http://www.parl.gc.ca/Parliamentarians/en/members/cathy-mcleod(217548)
4778907,ca.proc.d.2019-05-10.10621943,2019-05-10,e3cf1c1d-8785-480a-840e-d22557b891d7,242074,"Mr. Paul Lefebvre (Parliamentary Secretary to the Minister of Natural Resources, Lib.)",,Oral Questions,Natural Resources,,"Madam Speaker, there are a few things in that question. As I said before, we are focused on getting the TMX pipeline project done in the right way, something that the Conservatives completely ignored. For 10 years, they got no pipelines built. 
We want to make sure people have confidence in the process. The process we are going to follow is having full consultations and at the same time respecting our environmental obligations. That is what we are focused on. That is what Canadians have to have respect for and have to have confidence in for us to get it done in the right way.",Liberal,Sudbury,Paul Lefebvre,http://www.parl.gc.ca/Parliamentarians/en/members/paul-lefebvre(242074)
4778908,ca.proc.d.2019-05-10.10621945,2019-05-10,00000000-0000-0000-0000-000000000000,242552,"Ms. Jean Yip (Scarborough—Agincourt, Lib.)",,Oral Questions,Science and Technology,,"Madam Speaker, removing barriers in science, technology, engineering and mathematics, STEM, is fundamental to ensuring equity for researchers across out country. Our government recognizes that we must always strive to tear down these barriers and ensure under-represented groups can succeed and thrive in the STEM fields.
Can the Minister of Science and Sport please tell this House how our government's made-in-Canada Athena SWAN program will help us achieve this?",Liberal,Scarborough—Agincourt,Jean Yip,http://www.parl.gc.ca/Parliamentarians/en/members/jean-yip(242552)
4778909,ca.proc.d.2019-05-10.10621949,2019-05-10,c5378648-5d94-4645-bc05-339090e1077b,241725,"Hon. Kirsty Duncan (Minister of Science and Sport, Lib.)",,Oral Questions,Science and Technology,,"Madam Speaker, that is an excellent question. While the Harper Conservatives ignored diversity in research, we understand that we cannot afford to leave any talent on the sidelines. 
Yesterday I announced new grants and launched Dimensions, a made-in-Canada version of the internationally renowned Athena SWAN program. This will create more opportunities for women and other under-represented groups and institutions across Canada. 
This has been a long-standing problem. The Harper Conservatives did nothing to improve diversity. We are taking action.",Liberal,Etobicoke North,Kirsty Duncan,http://www.parl.gc.ca/Parliamentarians/en/members/kirsty-duncan(241725)
4778910,ca.proc.d.2019-05-10.10621951,2019-05-10,1ad00957-54b5-494d-8773-b530fbe4967b,218760,"Mr. Mel Arnold (North Okanagan—Shuswap, CPC)",,Oral Questions,Fisheries and Oceans,,"Madam Speaker, Liberal fisheries ministers continue to fail Pacific salmon and the Canadians who rely on them. Evidence of this failure is another layer of fishing restrictions that will put hundreds of British Columbians out of work. Instead of working against fishermen and coastal communities, the government should work with them to restore Pacific salmon stocks.
B.C. fishers and conservationists know how to put more salmon back in our streams and oceans, so when will the fisheries minister start working with the fishermen instead of just shutting them out of their fisheries?",Conservative,North Okanagan—Shuswap,Mel Arnold,http://www.parl.gc.ca/Parliamentarians/en/members/mel-arnold(218760)
4778911,ca.proc.d.2019-05-10.10621954,2019-05-10,e44116f8-75a8-4ca6-9ba5-fe968dbd42b0,242061,"Mr. Sean Casey (Parliamentary Secretary to the Minister of Fisheries, Oceans and the Canadian Coast Guard, Lib.)",,Oral Questions,Fisheries and Oceans,,"Madam Speaker, in actual fact this minister and this government have never stopped working with fishers and have never stopped working with conservationists.
The B.C. salmon conservation and innovation fund is a prime example. There have been over 100 million federal dollars coupled with provincial dollars to address the challenges facing B.C. salmon. That work will continue. The consultation will continue. We are very committed to the restoration of Pacific salmon.",Liberal,Charlottetown,Sean Casey,http://www.parl.gc.ca/Parliamentarians/en/members/sean-casey(242061)
4778912,ca.proc.d.2019-05-10.10621957,2019-05-10,530dc476-c9bf-477c-83e7-6efc545f2bf8,224177,"Mr. Luc Thériault (Montcalm, BQ)",,Oral Questions,International Trade,,"Madam Speaker, not a single penny in compensation will be going to supply-managed producers before the election. The Parliamentary Budget Officer confirmed it.
Farmers are already suffering the consequences of being sacrificed in the free trade agreements. To them, compensation is not an election issue, but an urgent need. The farmers say they want to see concrete action before the election, and that would include a cheque.
When will they get their cheque?",Bloc Québécois,Montcalm,Luc Thériault,http://www.parl.gc.ca/Parliamentarians/en/members/luc-theriault(224177)
4778913,ca.proc.d.2019-05-10.10621960,2019-05-10,ae40e780-7dd1-4e34-bf90-4dbb35c18443,242096,"Mr. Jean-Claude Poissant (Parliamentary Secretary to the Minister of Agriculture and Agri-Food, Lib.)",,Oral Questions,International Trade,,"Madam Speaker, our government has always been very clear. We are the party that brought in supply management and we will protect and promote it.
We committed to supporting our supply-managed producers fully and fairly by giving them $3.9 billion in compensation for the repercussions of CETA and CPTPP. The working groups continue to discuss the best way to distribute the money, and the minister hopes to finalize everything by the end of June.",Liberal,La Prairie,Jean-Claude Poissant,http://www.parl.gc.ca/Parliamentarians/en/members/jean-claude-poissant(242096)
4778914,ca.proc.d.2019-05-10.10621963,2019-05-10,530dc476-c9bf-477c-83e7-6efc545f2bf8,224177,"Mr. Luc Thériault (Montcalm, BQ)",,Oral Questions,International Trade,,"Madam Speaker, a cheque is exactly what people want. They have had it up to here with reassuring words. The Parliamentary Budget Officer says that if he were a farmer, he would be worried. There are only so many ways to reassure people. 
Rather than tell supply-managed farmers to vote Liberal if they want their cheque, will the government get those cheques in the mail before the end of the session?",Bloc Québécois,Montcalm,Luc Thériault,http://www.parl.gc.ca/Parliamentarians/en/members/luc-theriault(224177)
4778915,ca.proc.d.2019-05-10.10621966,2019-05-10,ae40e780-7dd1-4e34-bf90-4dbb35c18443,242096,"Mr. Jean-Claude Poissant (Parliamentary Secretary to the Minister of Agriculture and Agri-Food, Lib.)",,Oral Questions,International Trade,,"Madam Speaker, let me repeat that we are committed to fully and fairly supporting supply-managed farmers by giving them $3.9 billion in compensation for any negative repercussions of CETA and the CPTPP. We are also looking at the impact on processors and the potential impact of CUSMA. Working groups continue to discuss the best way to distribute the money.
I would also like to remind the House that all opposition members voted against the budget, which includes compensation for farmers.",Liberal,La Prairie,Jean-Claude Poissant,http://www.parl.gc.ca/Parliamentarians/en/members/jean-claude-poissant(242096)
4778916,ca.proc.d.2019-05-10.10621968,2019-05-10,530dc476-c9bf-477c-83e7-6efc545f2bf8,224177,"Mr. Luc Thériault (Montcalm, BQ)",,Oral Questions,Public Services and Procurement,,"Madam Speaker, the Conservatives' $100-billion naval strategy sought to ensure the survival of two of Canada's shipyards, even if it meant destroying Davie and all of its suppliers, mostly in Saguenay. When the Liberals took office, they wanted to finish the job the Conservatives started, finish off Davie and deprive it of contracts. That is what we learned from the Vice-Admiral Norman case.
Now that the government has stayed proceedings against the vice-admiral, does it also intend to abandon the Conservatives' naval strategy and finally treat Davie fairly?",Bloc Québécois,Montcalm,Luc Thériault,http://www.parl.gc.ca/Parliamentarians/en/members/luc-theriault(224177)
4778917,ca.proc.d.2019-05-10.10621971,2019-05-10,61edc25f-3448-46fd-9632-6c5c23fd98a6,241635,"Hon. Carla Qualtrough (Minister of Public Services and Procurement and Accessibility, Lib.)",,Oral Questions,Public Services and Procurement,,"Madam Speaker, we are very pleased with the Davie workers' productivity and the excellent work they did on the Asterix. We are working closely with all Quebec businesses. We awarded $1.6 billion in contracts to Quebec companies. We gave Davie a contract that was part of a $7-billion investment. We gave Davie $700 million for icebreakers. We certainly do recognize the work and professionalism of the Davie shipyard and its workers.",Liberal,Delta,Carla Qualtrough,http://www.parl.gc.ca/Parliamentarians/en/members/carla-qualtrough(241635)
4778918,ca.proc.d.2019-05-10.10621973,2019-05-10,3c3175ff-595b-4f50-a58d-b41cd7b5b100,214600,"Hon. Hunter Tootoo (Nunavut, Ind.)",,Oral Questions,Indigenous Affairs,,"Madam Speaker, my question is for the Minister of Indigenous Services.
 When it comes to health care, Nunavummiut do not get the same level of support from the federal government as other Canadians. The national average for federal support is 20%. Nunavut receives less than 10%. As a consequence, the Government of Nunavut is forced to pick up the tab for programs for which the federal government is responsible. The GN spends in excess of $50 million a year above what it is funded to administer the non-insured health benefits program. 
Does the Minister of Indigenous Services think this fair and will he work with the Government of Nunavut to fully fund the administration of this program?",Independent,Nunavut,Hunter Tootoo,http://www.parl.gc.ca/Parliamentarians/en/members/hunter-tootoo(214600)
4778919,ca.proc.d.2019-05-10.10621976,2019-05-10,2d98e2df-3246-4a59-8048-8be83adb2c42,242085,"Mr. Marc Miller (Parliamentary Secretary to the Minister of Crown-Indigenous Relations, Lib.)",,Oral Questions,Indigenous Affairs,,"Madam Speaker, our government is working in support of the Government of Nunavut in the provision of health services to its residents.
 Last week, the Minister of Indigenous Services met with the minister of health and finance for the Government of Nunavut to discuss health care and a number of other shared priorities. We continue to stay in close communication to ensure that Nunavummiut have access to the quality health services they need.",Liberal,Ville-Marie—Le Sud-Ouest—Île-des-Soeurs,Marc Miller,http://www.parl.gc.ca/Parliamentarians/en/members/marc-miller(242085)
4778920,ca.proc.d.2019-05-10.10621978,2019-05-10,62c4052f-dd41-418a-9b5b-1715c0baa84d,218417,Mr. Kelly McCauley,,Oral Questions,Indigenous Affairs,,"Madam Speaker, with permission of the House, I would like to table the recent Parliamentary Budget Officer's economic and fiscal update. We heard the parliamentary secretary from Global Affairs say that the $2 billion from steel and aluminum tariffs were being used to help out companies in Canada. This report shows that the huge majority of this money has disappeared into government coffers and has not extended to our industries.",Conservative,Edmonton West,Kelly McCauley,http://www.parl.gc.ca/Parliamentarians/en/members/kelly-mccauley(218417)
4778921,ca.proc.d.2019-05-10.10622099,2019-05-10,cedf1659-ebb1-4f26-b723-5c7c5353988b,214948,The Assistant Deputy Speaker (Mrs. Carol Hughes),,Oral Questions,Indigenous Affairs,,Does the hon. member have the unanimous consent of the House to table the document?,New Democratic Party,Algoma—Manitoulin—Kapuskasing,Carol Hughes,http://www.parl.gc.ca/Parliamentarians/en/members/carol-hughes(214948)
4778922,ca.proc.d.2019-05-10.p5904028,2019-05-10,,,,intervention,Oral Questions,Indigenous Affairs,," Agreed.
 No.",,,Some hon. members,
4778923,ca.proc.d.2019-05-10.10621986,2019-05-10,a76af2a6-7a43-4f8f-a887-0d10b3a0a3c1,218969,"Hon. Wayne Easter (Malpeque, Lib.)",,Routine Proceedings,Interparliamentary Delegations,,"Madam Speaker, pursuant to Standing Order 34(1) I have the honour to present to the House, in both official languages, three reports of the Canada-United States Inter-Parliamentary Group.
The first report concerns the Pacific NorthWest Economic Region's, PNWER, 28th annual summit, held in Spokane, Washington, United States of America, from July 23 to July 26, 2018.
The second report concerns the 58th annual meeting and regional policy forum of the Council of State Governments Eastern Regional Conference, held in Rye Brook, New York, U.S.A., from August 5 to August 8, 2018.
The third report concerns the annual National Conference of the Council of State Governments, held in Covington, Kentucky, U.S.A., from December 6 to December 8, 2018.",Liberal,Malpeque,Wayne Easter,http://www.parl.gc.ca/Parliamentarians/en/members/wayne-easter(218969)
4778924,ca.proc.d.2019-05-10.10621998,2019-05-10,9225dd6b-e672-44d5-8bb7-c634b7e72f2e,216609,"Hon. Michelle Rempel (Calgary Nose Hill, CPC)",,Routine Proceedings,Petitions,Equalization,"Madam Speaker, I am pleased to present a petition from many people across the country who call on the government to immediately cancel Bill C-69 and launch a study into the economic impact of equalization, including an examination of the formula.
The petitioners are really tired of the government telling them that they cannot work and that their jobs are dirty. They feel that the context for equalization has changed, after the Prime Minister has gone after jobs in the energy sector with great vigour.",Conservative,Calgary Nose Hill,Michelle Rempel,http://www.parl.gc.ca/Parliamentarians/en/members/michelle-rempel(216609)
4778925,ca.proc.d.2019-05-10.10622002,2019-05-10,00000000-0000-0000-0000-000000000000,234359,"Mrs. Stephanie Kusie (Calgary Midnapore, CPC)",,Routine Proceedings,Petitions,Animal Welfare,"Madam Speaker, I rise today to table a petition submitted by constituents in my riding of Calgary Midnapore.
 The petitioners clearly care deeply about the welfare of animals. They ask that the sale and/or manufacturing of animal-tested cosmetics and their ingredients be banned in Canada moving forward.",Conservative,Calgary Midnapore,Stephanie Kusie,http://www.parl.gc.ca/Parliamentarians/en/members/stephanie-kusie(234359)
4778926,ca.proc.d.2019-05-10.10622004,2019-05-10,77945d39-8e4a-4fd1-9786-441ff928f6f9,242431,"Mr. Bev Shipley (Lambton—Kent—Middlesex, CPC)",,Routine Proceedings,Petitions,Religious Freedom,"Madam Speaker, equality means that all people are treated fairly, without discrimination.
The petitioners call upon the House of Commons to permit Christians to robustly exercise their religious beliefs and conscience rights, both in their private and public acts, without coercion, constraint or discrimination.",Conservative,Lambton—Kent—Middlesex,Bev Shipley,http://www.parl.gc.ca/Parliamentarians/en/members/bev-shipley(242431)
4778927,ca.proc.d.2019-05-10.10622006,2019-05-10,b6850f16-57dc-486c-b5bb-0fd191022af4,242574,"Mr. Garnett Genuis (Sherwood Park—Fort Saskatchewan, CPC)",,Routine Proceedings,Petitions,Privacy and Data Protection,"Madam Speaker, I am pleased to table five petitions today.
The first petition was started at a time when Statistics Canada was reported to be collecting personal and banking information belonging to Canadians without their knowledge and consent.
The petitioners call upon the government to ensure this does not happen. They raise concerns about the need to set standards to prevent this sort of thing from ever occurring in the future.",Conservative,Sherwood Park—Fort Saskatchewan,Garnett Genuis,http://www.parl.gc.ca/Parliamentarians/en/members/garnett-genuis(242574)
4778928,ca.proc.d.2019-05-10.10622097,2019-05-10,b6850f16-57dc-486c-b5bb-0fd191022af4,242574,"Mr. Garnett Genuis (Sherwood Park—Fort Saskatchewan, CPC)",,Routine Proceedings,Petitions,Carbon Pricing,"Madam Speaker, the second petition deals with the carbon tax.
The petitioners note that a carbon tax will not in fact help the environment, especially compared with more effective measures, such as exporting Canadian technology to jurisdictions that are less environmentally responsible as well as not sending more jobs to other jurisdictions.
The petitioners call upon the government to reverse its efforts to impose a carbon tax on all of its provinces against their will.",Conservative,Sherwood Park—Fort Saskatchewan,Garnett Genuis,http://www.parl.gc.ca/Parliamentarians/en/members/garnett-genuis(242574)
4778929,ca.proc.d.2019-05-10.10622100,2019-05-10,b6850f16-57dc-486c-b5bb-0fd191022af4,242574,"Mr. Garnett Genuis (Sherwood Park—Fort Saskatchewan, CPC)",,Routine Proceedings,Petitions,Canada Summer Jobs Initiative,"Madam Speaker, the third petition deals with the Canada summer jobs program. It came in the context of the attestation requirement that was not only removed this year, but that groups were being denied equal access to the Canada summer jobs program based on their beliefs instead of their actions. This continues to be a concern to these petitioners and other Canadians.",Conservative,Sherwood Park—Fort Saskatchewan,Garnett Genuis,http://www.parl.gc.ca/Parliamentarians/en/members/garnett-genuis(242574)
4778930,ca.proc.d.2019-05-10.10622104,2019-05-10,b6850f16-57dc-486c-b5bb-0fd191022af4,242574,"Mr. Garnett Genuis (Sherwood Park—Fort Saskatchewan, CPC)",,Routine Proceedings,Petitions,Human Organ Trafficking,"Madam Speaker, the fourth petition is in support of Bill S-240, which is currently back before the Senate and seeks to address the scourge of forced organ harvesting.
The petitioners are hopeful that the Senate will move this forward as quickly as possible so it passes before the election.",Conservative,Sherwood Park—Fort Saskatchewan,Garnett Genuis,http://www.parl.gc.ca/Parliamentarians/en/members/garnett-genuis(242574)
4778931,ca.proc.d.2019-05-10.10622169,2019-05-10,b6850f16-57dc-486c-b5bb-0fd191022af4,242574,"Mr. Garnett Genuis (Sherwood Park—Fort Saskatchewan, CPC)",,Routine Proceedings,Petitions,Falun Gong,"Madam Speaker, the fifth and final petition raises the plight of persecuted Falun Gong practitioners in China.
The petitioners call on Chinese officials to immediately end the persecution of Falun Gong and release all prisoners of conscience, including Canadian citizens and their family members, and to take every opportunity to establish measures to investigate the Chinese regime's organ harvesting, the taking of organs from innocent people. Again that is a reference to Bill S-240.",Conservative,Sherwood Park—Fort Saskatchewan,Garnett Genuis,http://www.parl.gc.ca/Parliamentarians/en/members/garnett-genuis(242574)
4778932,ca.proc.d.2019-05-10.10622008,2019-05-10,bd2068aa-74c7-430a-bdf5-6f17b14ca140,217464,"Mr. Tom Kmiec (Calgary Shepard, CPC)",,Routine Proceedings,Petitions,Human Organ Trafficking,"Madam Speaker, today, I am tabling a petition in support of Bill S-240, which would combat the scourge of forced organ harvesting. This bill is currently before the Senate. I hope it will be passed quickly.",Conservative,Calgary Shepard,Tom Kmiec,http://www.parl.gc.ca/Parliamentarians/en/members/tom-kmiec(217464)
4778933,ca.proc.d.2019-05-10.10622010,2019-05-10,22a96405-bed6-45e9-811a-69d055416803,242520,"Hon. Steven Blaney (Bellechasse—Les Etchemins—Lévis, CPC)",,Routine Proceedings,Petitions,Human Organ Trafficking,"Madam Speaker, I would also like to table a petition signed by Canadians who are calling on parliamentarians to support two legislative initiatives to prevent the trafficking of human organs removed without consent or as a result of a financial transaction.",Conservative,Bellechasse—Les Etchemins—Lévis,Steven Blaney,http://www.parl.gc.ca/Parliamentarians/en/members/steven-blaney(242520)
4778934,ca.proc.d.2019-05-10.10622012,2019-05-10,1ad00957-54b5-494d-8773-b530fbe4967b,218760,"Mr. Mel Arnold (North Okanagan—Shuswap, CPC)",,Routine Proceedings,Petitions,Human Organ Trafficking,"Madam Speaker, I as well have a petition today from residents across Canada who call on the Parliament of Canada and the government to move quickly on the proposed legislation to ban trafficking of human organs around the world. The act would prohibit Canadians from travelling abroad to acquire human organs removed without consent or as a result of financial transaction and to render inadmissible to Canada any and all permanent residents or foreign nationals who have participated in this abhorrent trade in human organs.",Conservative,North Okanagan—Shuswap,Mel Arnold,http://www.parl.gc.ca/Parliamentarians/en/members/mel-arnold(218760)
4778935,ca.proc.d.2019-05-10.10622015,2019-05-10,48fc6e8f-3117-407b-bba3-bd6eede347ec,224672,"Hon. Bardish Chagger (Leader of the Government in the House of Commons, Lib.)",,Routine Proceedings,Questions on the Order Paper,,"Madam Speaker, I ask that all questions be allowed to stand.",Liberal,Waterloo,Bardish Chagger,http://www.parl.gc.ca/Parliamentarians/en/members/bardish-chagger(224672)
4778936,ca.proc.d.2019-05-10.10622017,2019-05-10,cedf1659-ebb1-4f26-b723-5c7c5353988b,214948,The Assistant Deputy Speaker (Mrs. Carol Hughes),,Routine Proceedings,Questions on the Order Paper,,Is that agreed?,New Democratic Party,Algoma—Manitoulin—Kapuskasing,Carol Hughes,http://www.parl.gc.ca/Parliamentarians/en/members/carol-hughes(214948)
4778937,ca.proc.d.2019-05-10.p5904056,2019-05-10,,,,intervention,Routine Proceedings,Questions on the Order Paper,, Agreed.,,,Some hon. members,
4778938,ca.proc.d.2019-05-10.p5904057,2019-05-10,,,,stagedirection,Government Orders,Oceans Act,, The House resumed consideration of the motion.,,,,
